{
  "schema": "h3.context.nle_control_coverage_manifest.v2",
  "version": 2,
  "operation_profile_id": "h3.authoring.nle_operation.v1",
  "surface": "overlay_v1",
  "authority_classes": [
    "canonical_edit",
    "canonical_derived_effect",
    "local_transport",
    "output_action",
    "read_only_observation",
    "deferred_unavailable"
  ],
  "command_rows": [
    {
      "operation_id": "track.add",
      "control_selector": "[data-h3-nle-control=\"track.add\"]",
      "gesture": "activate",
      "alternate_selectors": [],
      "role": "menuitem",
      "accessible_name": "Add track",
      "state_attributes": [
        "disabled"
      ],
      "authority_class": "canonical_edit",
      "command": "create_track",
      "route": "/h3-context/v1/authoring action=apply_timeline_transaction",
      "receipt_fields": "transaction/revision/fingerprint + new track ID/order",
      "accepted_projection_selector": "[data-h3-nle-status=\"timeline\"][data-h3-nle-authoring=\"ready\"]",
      "observation": "empty layer appears at exact order; no media/audio change",
      "render_affecting": false,
      "evidence": {
        "pointer": "e2e/journeys/nleWorkspace.spec.ts::canonical track controls add, reorder, disable, lock and remove the accepted track",
        "keyboard": "e2e/journeys/nleCommandMatrix.spec.ts::matrix track.add keyboard activation issues one create_track the core accepts",
        "stress": "e2e/journeys/nleShellBudget.spec.ts::virtualized integrated shell discrete decoded edit stays within four NLE commits and handler budget",
        "recovery": "e2e/journeys/nleCommandMatrix.spec.ts::matrix track.add stale revision is refused by the core and recovers only by an explicit fresh command",
        "effect": "e2e/journeys/nleWorkspace.spec.ts::canonical track controls add, reorder, disable, lock and remove the accepted track"
      }
    },
    {
      "operation_id": "track.remove",
      "control_selector": "[data-h3-nle-control=\"track.remove\"]",
      "gesture": "activate",
      "alternate_selectors": [],
      "role": "menuitem",
      "accessible_name": "Remove track",
      "state_attributes": [
        "disabled"
      ],
      "authority_class": "canonical_edit",
      "command": "remove_track",
      "route": "/h3-context/v1/authoring action=apply_timeline_transaction",
      "receipt_fields": "affected track + new fingerprint",
      "accepted_projection_selector": "[data-h3-nle-status=\"timeline\"][data-h3-nle-authoring=\"ready\"]",
      "observation": "empty layer disappears; non-empty rejection leaves scene unchanged",
      "render_affecting": false,
      "evidence": {
        "pointer": "e2e/journeys/nleWorkspace.spec.ts::canonical track controls add, reorder, disable, lock and remove the accepted track",
        "keyboard": "e2e/journeys/nleCommandMatrix.spec.ts::matrix track.remove keyboard activation issues one remove_track the core accepts",
        "stress": "e2e/journeys/nleShellBudget.spec.ts::virtualized integrated shell discrete decoded edit stays within four NLE commits and handler budget",
        "recovery": "e2e/journeys/nleCommandMatrix.spec.ts::matrix track.remove stale revision is refused by the core and recovers only by an explicit fresh command",
        "effect": "e2e/journeys/nleWorkspace.spec.ts::canonical track controls add, reorder, disable, lock and remove the accepted track"
      }
    },
    {
      "operation_id": "track.reorder",
      "control_selector": "[data-h3-nle-control=\"track.reorder\"]",
      "gesture": "activate",
      "alternate_selectors": [],
      "role": "menuitem",
      "accessible_name": "Reorder track",
      "state_attributes": [
        "disabled"
      ],
      "authority_class": "canonical_edit",
      "command": "reorder_track",
      "route": "/h3-context/v1/authoring action=apply_timeline_transaction",
      "receipt_fields": "canonical track order",
      "accepted_projection_selector": "[data-h3-nle-status=\"timeline\"][data-h3-nle-authoring=\"ready\"]",
      "observation": "visual layer order changes exactly; derived audio unchanged",
      "render_affecting": true,
      "evidence": {
        "pointer": "e2e/journeys/nleWorkspace.spec.ts::canonical track controls add, reorder, disable, lock and remove the accepted track",
        "keyboard": "e2e/journeys/nleCommandMatrix.spec.ts::matrix track.reorder keyboard activation issues one reorder_track the core accepts",
        "stress": "e2e/journeys/nleShellBudget.spec.ts::virtualized integrated shell discrete decoded edit stays within four NLE commits and handler budget",
        "recovery": "e2e/journeys/nleCommandMatrix.spec.ts::matrix track.reorder stale revision is refused by the core and recovers only by an explicit fresh command",
        "effect": "e2e/journeys/nleWorkspace.spec.ts::canonical track controls add, reorder, disable, lock and remove the accepted track"
      }
    },
    {
      "operation_id": "track.enabled",
      "control_selector": "[data-h3-nle-control=\"track.enabled\"]",
      "gesture": "activate",
      "alternate_selectors": [],
      "role": "button",
      "accessible_name": "Show {track}",
      "state_attributes": [
        "disabled",
        "aria-pressed"
      ],
      "authority_class": "canonical_edit",
      "command": "set_track_enabled",
      "route": "/h3-context/v1/authoring action=apply_timeline_transaction",
      "receipt_fields": "track state + fingerprint",
      "accepted_projection_selector": "[data-h3-nle-status=\"timeline\"][data-h3-nle-authoring=\"ready\"]",
      "observation": "visual layers appear/disappear; primary-video audio follows the accepted primary state",
      "render_affecting": true,
      "evidence": {
        "pointer": "e2e/journeys/nleWorkspace.spec.ts::canonical track controls add, reorder, disable, lock and remove the accepted track",
        "keyboard": "e2e/journeys/nleCommandMatrix.spec.ts::matrix track.enabled keyboard activation issues one set_track_enabled the core accepts",
        "stress": "e2e/journeys/nleShellBudget.spec.ts::virtualized integrated shell discrete decoded edit stays within four NLE commits and handler budget",
        "recovery": "e2e/journeys/nleCommandMatrix.spec.ts::matrix track.enabled stale revision is refused by the core and recovers only by an explicit fresh command",
        "effect": "e2e/journeys/nleWorkspace.spec.ts::canonical track controls add, reorder, disable, lock and remove the accepted track"
      }
    },
    {
      "operation_id": "track.locked",
      "control_selector": "[data-h3-nle-control=\"track.locked\"]",
      "gesture": "activate",
      "alternate_selectors": [],
      "role": "button",
      "accessible_name": "Lock {track}",
      "state_attributes": [
        "disabled",
        "aria-pressed"
      ],
      "authority_class": "canonical_edit",
      "command": "set_track_locked",
      "route": "/h3-context/v1/authoring action=apply_timeline_transaction",
      "receipt_fields": "track state + fingerprint",
      "accepted_projection_selector": "[data-h3-nle-status=\"timeline\"][data-h3-nle-authoring=\"ready\"]",
      "observation": "edit guards change; rendered scene and embedded audio remain unchanged",
      "render_affecting": false,
      "evidence": {
        "pointer": "e2e/journeys/nleWorkspace.spec.ts::canonical track controls add, reorder, disable, lock and remove the accepted track",
        "keyboard": "e2e/journeys/nleCommandMatrix.spec.ts::matrix track.locked keyboard activation issues one set_track_locked the core accepts",
        "stress": "e2e/journeys/nleShellBudget.spec.ts::virtualized integrated shell discrete decoded edit stays within four NLE commits and handler budget",
        "recovery": "e2e/journeys/nleCommandMatrix.spec.ts::matrix track.locked stale revision is refused by the core and recovers only by an explicit fresh command",
        "effect": "e2e/journeys/nleWorkspace.spec.ts::canonical track controls add, reorder, disable, lock and remove the accepted track"
      }
    },
    {
      "operation_id": "asset.insert",
      "control_selector": "[data-h3-nle-control=\"asset.insert\"]",
      "gesture": "activate",
      "alternate_selectors": [],
      "role": "button",
      "accessible_name": "Add {asset} to the timeline",
      "state_attributes": [
        "disabled"
      ],
      "authority_class": "canonical_edit",
      "command": "insert_asset_clip",
      "route": "/h3-context/v1/authoring action=apply_timeline_transaction",
      "receipt_fields": "new clip/asset/track geometry",
      "accepted_projection_selector": "[data-h3-nle-status=\"timeline\"][data-h3-nle-authoring=\"ready\"]",
      "observation": "new visual layer and, on primary VIDEO, matching derived audio span",
      "render_affecting": true,
      "evidence": {
        "pointer": "e2e/journeys/nleCommandMatrix.spec.ts::matrix asset.insert stale revision is refused by the core and recovers only by an explicit fresh command",
        "keyboard": "e2e/journeys/nleCommandMatrix.spec.ts::matrix asset.insert keyboard activation issues one insert_asset_clip the core accepts",
        "stress": "e2e/journeys/nleShellBudget.spec.ts::virtualized integrated shell discrete decoded edit stays within four NLE commits and handler budget",
        "recovery": "e2e/journeys/nleCommandMatrix.spec.ts::matrix asset.insert stale revision is refused by the core and recovers only by an explicit fresh command",
        "effect": "e2e/journeys/nleWorkspace.spec.ts::canonical asset insertion adds one clip without replacing existing clips"
      }
    },
    {
      "operation_id": "title.insert",
      "control_selector": "[data-h3-nle-control=\"title.insert\"]",
      "gesture": "activate",
      "alternate_selectors": [],
      "role": "button",
      "accessible_name": "Add title",
      "state_attributes": [
        "disabled"
      ],
      "authority_class": "canonical_edit",
      "command": "insert_title_clip",